{"$schema":"https://json-schema.org/draft/2020-12/schema","$id":"runne.release.publication-effect-settlement/1","title":"Publication Effect Settlement V1","type":"object","additionalProperties":false,"required":["schema_version","idempotency_namespace","generation","destination_readback_sha256","executable_sha256","workflow_sha256","observed_result"],"properties":{"schema_version":{"const":"runne.release.publication-effect-settlement/1"},"idempotency_namespace":{"type":"string","minLength":1,"pattern":"^[^\\s]+$"},"generation":{"type":"integer","minimum":1,"maximum":18446744073709551615},"destination_readback_sha256":{"type":"string","pattern":"^[0-9a-f]{64}$"},"executable_sha256":{"type":"string","pattern":"^[0-9a-f]{64}$"},"workflow_sha256":{"type":"string","pattern":"^[0-9a-f]{64}$"},"observed_result":{"enum":["succeeded","absent","inconclusive"]}}}
