{"destination_readback_sha256":"abababababababababababababababababababababababababababababababab","executable_sha256":"cdcdcdcdcdcdcdcdcdcdcdcdcdcdcdcdcdcdcdcdcdcdcdcdcdcdcdcdcdcdcdcd","generation":1,"idempotency_namespace":"ns-1","observed_result":"succeeded","schema_version":"runne.release.publication-effect-settlement/1","workflow_sha256":"efefefefefefefefefefefefefefefefefefefefefefefefefefefefefefefef"}
